--------------
SELECT * FROM Driver WHERE userID = 1
--------------

+--------+--------+
| userID | rating |
+--------+--------+
|      1 |   2.96 |
+--------+--------+
1 row in set (0.00 sec)

--------------
UPDATE Travelled SET rating = "5.0" WHERE driverID = "1" AND vehicleID = "1" AND tripID = "1" AND passengerID = "896"
--------------

Query OK, 1 row affected (0.00 sec)
Rows matched: 1  Changed: 1  Warnings: 0

--------------
SELECT * FROM Driver WHERE userID = "1"
--------------

+--------+--------+
| userID | rating |
+--------+--------+
|      1 |   3.19 |
+--------+--------+
1 row in set (0.00 sec)

Bye
